sentence,sentiment,cleaned_sentence,positive_score,negative_score,neutral_score,tiempo_fuzzification,sentimiento_defuzzificado,tiempo_defuzzificacion,tiempo_total
i loooooooovvvvvveee my kindle not that the dx is cool but the is fantastic in its own right,Positive,i loooooooovvvvvveee my kindle not that the dx is cool but the is fantastic in its own right,0.382,0.0,0.618,0.022599997464567423,Positive,0.10650000331224874,0.12910000077681616
reading my kindle love it lee childs is good read,Positive,reading my kindle love it lee childs is good read,0.47,0.0,0.53,0.011600001016631722,Positive,0.07729999924777076,0.08890000026440248
ok first assesment of the kindle it fucking rocks,Positive,ok first assesment of the kindle it fucking rocks,0.216,0.0,0.784,0.009699993825051934,Neutral,0.08610000077169389,0.09579999459674582
you ll love your kindle i ve had mine for a few months and never looked back the new big one is huge no need for remorse,Positive,you ll love your kindle i ve had mine for a few months and never looked back the new big one is huge no need for remorse,0.204,0.135,0.66,0.01080000220099464,Neutral,0.07069999992381781,0.08150000212481245
fair enough but i have the kindle and i think it s perfect,Positive,fair enough but i have the kindle and i think it s perfect,0.456,0.0,0.544,0.009800001862458885,Positive,0.06479999865405262,0.0746000005165115
no it is too big i m quite happy with the kindle,Positive,no it is too big i m quite happy with the kindle,0.281,0.155,0.564,0.00979999458650127,Neutral,0.07199999527074397,0.08179998985724524
fuck this economy i hate aig and their non loan given asses,Negative,fuck this economy i hate aig and their non loan given asses,0.0,0.444,0.556,0.009399998816661537,Negative,0.06779999966965988,0.07719999848632142
jquery is my new best friend,Positive,jquery is my new best friend,0.649,0.0,0.351,0.009499999578110874,Positive,0.0625000029685907,0.07200000254670158
loves twitter,Positive,loves twitter,0.787,0.0,0.213,0.017799997294787318,Positive,0.12329999299254268,0.14109999028733
how can you not love obama he makes jokes about himself,Positive,how can you not love obama he makes jokes about himself,0.139,0.234,0.626,0.010199997632298619,Neutral,0.2108000044245273,0.2210000020568259
i firmly believe that obama pelosi have zero desire to be civil it s a charade and a slogan but they want to destroy conservatism,Negative,i firmly believe that obama pelosi have zero desire to be civil it s a charade and a slogan but they want to destroy conservatism,0.127,0.182,0.691,0.009800001862458885,Neutral,0.2516999957151711,0.26149999757763
house correspondents dinner was last night whoopi barbara amp sherri went obama got a standing ovation,Positive,house correspondents dinner was last night whoopi barbara amp sherri went obama got a standing ovation,0.0,0.0,1.0,0.008899995009414852,Neutral,0.490999998874031,0.49989999388344586
watchin espn jus seen this new nike commerical with a puppet lebron sh t was hilarious lmao,Positive,watchin espn jus seen this new nike commerical with a puppet lebron sh t was hilarious lmao,0.337,0.0,0.663,0.009200004569720477,Positive,0.18309999722987413,0.1923000017995946
dear nike stop with the flywire that shit is a waste of science and ugly love,Negative,dear nike stop with the flywire that shit is a waste of science and ugly love,0.245,0.43,0.325,0.009999996109399945,Neutral,0.12550000246847048,0.13549999857787043
lebron best athlete of our generation if not all time basketball related i don t want to get into inter sport debates about __,Positive,lebron best athlete of our generation if not all time basketball related i don t want to get into inter sport debates about,0.224,0.0,0.776,0.0092999980552122,Neutral,0.11180000001331791,0.12109999806853011
i was talking to this guy last night and he was telling me that he is a die hard spurs fan he also told me that he hates lebron james,Negative,i was talking to this guy last night and he was telling me that he is a die hard spurs fan he also told me that he hates lebron james,0.067,0.238,0.696,0.009800001862458885,Neutral,0.13980000221636146,0.14960000407882035
i love lebron,Positive,i love lebron,0.808,0.0,0.192,0.009499999578110874,Positive,0.11870000162161887,0.12820000119972974
lebron is a beast but i m still cheering the a til the end,Negative,lebron is a beast but i m still cheering the a til the end,0.331,0.0,0.669,0.0092999980552122,Positive,0.1875000016298145,0.1967999996850267
lebron is the boss,Positive,lebron is the boss,0.0,0.0,1.0,0.008700000762473792,Neutral,0.23460000375052914,0.24330000451300293
lebron is a hometown hero to me lol i love the lakers but let s go cavs lol,Positive,lebron is a hometown hero to me lol i love the lakers but let s go cavs lol,0.488,0.0,0.512,0.009399998816661537,Positive,0.148899998748675,0.15829999756533653
lebron and zydrunas are such an awesome duo,Positive,lebron and zydrunas are such an awesome duo,0.369,0.0,0.631,0.009000003046821803,Positive,0.19040000188397244,0.19940000493079424
lebron is a beast nobody in the nba comes even close,Positive,lebron is a beast nobody in the nba comes even close,0.0,0.0,1.0,0.00809999619377777,Neutral,0.240100001974497,0.24819999816827476
downloading apps for my iphone so much fun there literally is an app for just about anything,Positive,downloading apps for my iphone so much fun there literally is an app for just about anything,0.183,0.0,0.817,0.008800001523923129,Neutral,0.09580000187270343,0.10460000339662656
good news just had a call from the visa office saying everything is fine what a relief i am sick of scams out there stealing,Positive,good news just had a call from the visa office saying everything is fine what a relief i am sick of scams out there stealing,0.225,0.312,0.462,0.009700001101009548,Neutral,0.08119999984046444,0.09090000094147399
awesome come back from via,Positive,awesome come back from via,0.506,0.0,0.494,0.009099996532313526,Positive,0.06909999501658604,0.07819999154889956
in montreal for a long weekend of r amp r much needed,Positive,in montreal for a long weekend of r amp r much needed,0.0,0.0,1.0,0.008100003469735384,Neutral,0.1066999975591898,0.11480000102892518
booz allen hamilton has a bad ass homegrown social collaboration platform way cool ttiv,Positive,booz allen hamilton has a bad ass homegrown social collaboration platform way cool ttiv,0.422,0.0,0.578,0.009200004569720477,Positive,0.0714999987394549,0.08070000330917537
mluc customer innovation award winner booz allen hamilton,Positive,mluc customer innovation award winner booz allen hamilton,0.664,0.0,0.336,0.009099996532313526,Positive,0.06769999890821055,0.07679999544052407
i current use the nikon d and love it but not as much as the canon d d i chose the d for the video feature my mistake,Positive,i current use the nikon d and love it but not as much as the canon d d i chose the d for the video feature my mistake,0.101,0.121,0.778,0.009499999578110874,Neutral,0.13730000500800088,0.14680000458611175
google is always a good place to look should ve mentioned i worked on the mustang w my dad,Positive,google is always a good place to look should ve mentioned i worked on the mustang w my dad,0.162,0.0,0.838,0.008999995770864189,Neutral,0.08689999958733097,0.09589999535819516
played with an android google phone the slide out screen scares me i would break that fucker so fast still prefer my iphone,Negative,played with an android google phone the slide out screen scares me i would break that fucker so fast still prefer my iphone,0.085,0.238,0.676,0.009800001862458885,Neutral,0.07919999916339293,0.08900000102585182
us planning to resume the military tribunals at guantanamo bay only this time those on trial will be aig execs and chrysler debt holders,Negative,us planning to resume the military tribunals at guantanamo bay only this time those on trial will be aig execs and chrysler debt holders,0.0,0.098,0.902,0.009399998816661537,Neutral,0.11950000043725595,0.12889999925391749
omg so bored amp my tattoooos are so itchy help aha,Negative,omg so bored amp my tattoooos are so itchy help aha,0.185,0.319,0.497,0.009800001862458885,Neutral,0.17550000484334305,0.18530000670580193
i m itchy and miserable,Negative,i m itchy and miserable,0.0,0.841,0.159,0.0092999980552122,Negative,0.2378999997745268,0.247199997829739
no i m not itchy for now maybe later lol,Negative,no i m not itchy for now maybe later lol,0.391,0.186,0.423,0.014099998224992305,Neutral,0.15239999629557133,0.16649999452056363
rt i love the nerdy stanford human biology videos makes me miss school,Positive,rt i love the nerdy stanford human biology videos makes me miss school,0.263,0.175,0.562,0.00979999458650127,Neutral,0.08920000254875049,0.09899999713525176
has been a bit crazy with steep learning curve but lyx is really good for long docs for anything shorter it would be insane,Positive,has been a bit crazy with steep learning curve but lyx is really good for long docs for anything shorter it would be insane,0.145,0.178,0.677,0.011200005246791989,Neutral,0.08240000170189887,0.09360000694869086
i m listening to p y t by danny gokey lt lt lt aww he s so amazing i lt him so much,Positive,i m listening to p y t by danny gokey lt lt lt aww he s so amazing i lt him so much,0.245,0.0,0.755,0.008899995009414852,Neutral,0.08759999764151871,0.09649999265093356
is going to sleep then on a bike ride,Positive,is going to sleep then on a bike ride,0.0,0.0,1.0,0.008700000762473792,Neutral,0.10489999840501696,0.11359999916749075
cant sleep my tooth is aching,Negative,cant sleep my tooth is aching,0.0,0.39,0.61,0.00910000380827114,Negative,0.09240000508725643,0.10150000889552757
blah blah blah same old same old no plans today going back to sleep i guess,Negative,blah blah blah same old same old no plans today going back to sleep i guess,0.0,0.368,0.632,0.008700000762473792,Negative,0.08659999730298296,0.09529999806545675
glad i didnt do bay to breakers today it s freaking degrees in san francisco wtf,Negative,glad i didnt do bay to breakers today it s freaking degrees in san francisco wtf,0.146,0.32,0.534,0.009800001862458885,Neutral,0.0822000001790002,0.09200000204145908
obama administration must stop bonuses to aig ponzi schemers,Negative,obama administration must stop bonuses to aig ponzi schemers,0.281,0.172,0.547,0.009800001862458885,Neutral,0.11069999891333282,0.1205000007757917
started to think that citi is in really deep s amp t are they gonna survive the turmoil or are they gonna be the next aig,Negative,started to think that citi is in really deep s amp t are they gonna survive the turmoil or are they gonna be the next aig,0.0,0.098,0.902,0.009000003046821803,Neutral,0.09519999730400741,0.10420000035082921
shaunwoo hate n on aig,Negative,shaunwoo hate n on aig,0.0,0.552,0.448,0.0092999980552122,Negative,0.07490000280085951,0.08420000085607171
you will not regret going to see star trek it was awesome,Positive,you will not regret going to see star trek it was awesome,0.391,0.0,0.609,0.009099996532313526,Positive,0.12109999806853011,0.13019999460084364
annoying new trend on the internets people picking apart michael lewis and malcolm gladwell nobody wants to read that,Negative,annoying new trend on the internets people picking apart michael lewis and malcolm gladwell nobody wants to read that,0.0,0.13,0.87,0.011100004485342652,Neutral,0.09809999755816534,0.109200002043508
highly recommend by malcolm gladwell,Positive,highly recommend by malcolm gladwell,0.411,0.0,0.589,0.010200004908256233,Positive,0.076299998909235,0.08650000381749123
blink by malcolm gladwell amazing book and the tipping point,Positive,blink by malcolm gladwell amazing book and the tipping point,0.297,0.0,0.703,0.010299998393747956,Neutral,0.12409999908413738,0.13439999747788534
malcolm gladwell might be my new man crush,Positive,malcolm gladwell might be my new man crush,0.0,0.186,0.814,0.009999996109399945,Neutral,0.10990000009769574,0.11989999620709568
omg the commercials alone on espn are going to drive me nuts,Negative,omg the commercials alone on espn are going to drive me nuts,0.0,0.301,0.699,0.01049999991664663,Neutral,0.0962999984039925,0.10679999832063913
playing with twitter api sounds fun may need to take a class or find a new friend who like to generate results with api code,Positive,playing with twitter api sounds fun may need to take a class or find a new friend who like to generate results with api code,0.362,0.0,0.638,0.009999996109399945,Positive,0.11069999891333282,0.12069999502273276
hello twitter api,Positive,hello twitter api,0.0,0.0,1.0,0.009399998816661537,Neutral,0.11129999620607123,0.12069999502273276
because the twitter api is slow and most client s aren t good,Negative,because the twitter api is slow and most client s aren t good,0.24,0.0,0.76,0.010000003385357559,Neutral,0.09050000517163426,0.10050000855699182
yahoo answers can be a butt sometimes,Negative,yahoo answers can be a butt sometimes,0.0,0.0,1.0,0.009400006092619151,Neutral,0.11069999891333282,0.12010000500595197
is scrapbooking with nic d,Positive,is scrapbooking with nic d,0.0,0.0,1.0,0.009499999578110874,Neutral,0.11000000085914508,0.11950000043725595
rt five things wolfram alpha does better and vastly different than google,Positive,rt five things wolfram alpha does better and vastly different than google,0.209,0.0,0.791,0.010000003385357559,Neutral,0.08550000347895548,0.09550000686431304
just changed my default pic to a nike basketball cause bball is awesome,Positive,just changed my default pic to a nike basketball cause bball is awesome,0.272,0.0,0.728,0.0109999964479357,Neutral,0.08850000449456275,0.09950000094249845
rt was just told that nike layoffs started today,Negative,rt was just told that nike layoffs started today,0.0,0.0,1.0,0.01219999830937013,Neutral,0.127500003145542,0.13970000145491213
back when i worked for nike we had one fav word just do it,Positive,back when i worked for nike we had one fav word just do it,0.2,0.0,0.8,0.014499993994832039,Neutral,0.08589999924879521,0.10039999324362725
by the way i m totally inspired by this freaky nike commercial,Positive,by the way i m totally inspired by this freaky nike commercial,0.25,0.179,0.572,0.018300001102034003,Neutral,0.08450000314041972,0.10280000424245372
class the d is supposed to come today,Positive,class the d is supposed to come today,0.0,0.0,1.0,0.008600000001024455,Neutral,0.11119999544462189,0.11979999544564635
needs someone to explain lambda calculus to him,Negative,needs someone to explain lambda calculus to him,0.0,0.0,1.0,0.019599996448960155,Neutral,0.14859999646432698,0.16819999291328713
took the graduate field exam for computer science today nothing makes you feel like more of an idiot than lambda calculus,Negative,took the graduate field exam for computer science today nothing makes you feel like more of an idiot than lambda calculus,0.1,0.142,0.758,0.009700001101009548,Neutral,0.15829999756533653,0.16799999866634607
shout outs to all east palo alto for being in the buildin karizmakaze cal gta also thanks to profits of doom universal hempz cracka,Positive,shout outs to all east palo alto for being in the buildin karizmakaze cal gta also thanks to profits of doom universal hempz cracka,0.197,0.092,0.712,0.009499999578110874,Neutral,0.09169999975711107,0.10119999933522195
yeahhhhhhhhh i wouldn t really have lived in east palo alto if i could have avoided it i guess it s only for the summer,Negative,yeahhhhhhhhh i wouldn t really have lived in east palo alto if i could have avoided it i guess it s only for the summer,0.0,0.112,0.888,0.008999995770864189,Neutral,0.1038999980664812,0.11289999383734539
great stanford course thanks for making it available to the public really helpful and informative for starting off,Positive,great stanford course thanks for making it available to the public really helpful and informative for starting off,0.402,0.0,0.598,0.009000003046821803,Positive,0.1106000054278411,0.1196000084746629
work til pm lets go lakers,Positive,work til pm lets go lakers,0.0,0.0,1.0,0.008600000001024455,Neutral,0.11690000246744603,0.12550000246847048
damn you north korea,Negative,damn you north korea,0.0,0.474,0.526,0.011199997970834374,Negative,0.07690000347793102,0.0881000014487654
can we just go ahead and blow north korea off the map already,Negative,can we just go ahead and blow north korea off the map already,0.0,0.0,1.0,0.008700000762473792,Neutral,0.11649999942164868,0.12520000018412247
north korea please cease this douchebaggery china doesn t even like you anymore,Negative,north korea please cease this douchebaggery china doesn t even like you anymore,0.324,0.0,0.676,0.008999995770864189,Positive,0.09410000347997993,0.10309999925084412
why the hell is pelosi in freakin china and on whose dime,Negative,why the hell is pelosi in freakin china and on whose dime,0.0,0.295,0.705,0.009000003046821803,Neutral,0.08459999662591144,0.09359999967273325
are you burning more cash than chrysler and gm stop the financial tsunami where bailout means taking a handout,Negative,are you burning more cash than chrysler and gm stop the financial tsunami where bailout means taking a handout,0.0,0.184,0.816,0.008899995009414852,Neutral,0.0988000028883107,0.10769999789772555
insects have infected my spinach plant,Negative,insects have infected my spinach plant,0.0,0.39,0.61,0.009000003046821803,Negative,0.08819999493425712,0.09719999798107892
wish i could catch every mosquito in the world n burn em slowly they been bitin the shit outta me day mosquitos are the assholes of insects,Negative,wish i could catch every mosquito in the world n burn em slowly they been bitin the shit outta me day mosquitos are the assholes of insects,0.206,0.117,0.677,0.009499999578110874,Neutral,0.07750000077066943,0.0870000003487803
just got back from church and i totally hate insects,Negative,just got back from church and i totally hate insects,0.0,0.333,0.667,0.009099996532313526,Neutral,0.09399999544257298,0.1030999919748865
just got mcdonalds goddam those eggs make me sick o yeah laker up date go lakers not much of an update well it s true so suck it,Negative,just got mcdonalds goddam those eggs make me sick o yeah laker up date go lakers not much of an update well it s true so suck it,0.189,0.28,0.531,0.00960000033956021,Neutral,0.07789999654050916,0.08749999688006938
omgg i ohhdee want mcdonalds damn i wonder if its open lol,Positive,omgg i ohhdee want mcdonalds damn i wonder if its open lol,0.297,0.196,0.507,0.009499999578110874,Neutral,0.07639999967068434,0.08589999924879521
history exam studying ugh,Negative,history exam studying ugh,0.0,0.483,0.517,0.009199997293762863,Negative,0.0718000010238029,0.08099999831756577
i hate revision it s so boring i am totally unprepared for my exam tomorrow things are not looking good,Negative,i hate revision it s so boring i am totally unprepared for my exam tomorrow things are not looking good,0.0,0.394,0.606,0.009000003046821803,Negative,0.09549999958835542,0.10450000263517722
higher physics exam tommorow not lookin forward to it much,Negative,higher physics exam tommorow not lookin forward to it much,0.0,0.0,1.0,0.00839999847812578,Neutral,0.11320000339765102,0.1216000018757768
it s a bank holiday yet i m only out of work now exam season sucks,Negative,it s a bank holiday yet i m only out of work now exam season sucks,0.178,0.164,0.658,0.01049999991664663,Neutral,0.08209999941755086,0.09259999933419749
cheney and bush are the real culprits,Negative,cheney and bush are the real culprits,0.0,0.0,1.0,0.008700000762473792,Neutral,0.23700000019744039,0.24570000095991418
life s a bitch and so is dick cheney p bipart tlot tcot hhrs gop dnc,Negative,life s a bitch and so is dick cheney p bipart tlot tcot hhrs gop dnc,0.0,0.401,0.599,0.009300005331169814,Negative,0.15700000221841037,0.1663000075495802
dick cheney s dishonest speech about torture terror and obama fred kaplan slate,Negative,dick cheney s dishonest speech about torture terror and obama fred kaplan slate,0.0,0.641,0.359,0.01309999788645655,Negative,0.10479999764356762,0.11789999553002417
the republican party is a bunch of anti abortion zealots who couldn t draw flies to a dump neal boortz just now on the radio,Negative,the republican party is a bunch of anti abortion zealots who couldn t draw flies to a dump neal boortz just now on the radio,0.099,0.245,0.657,0.009499999578110874,Neutral,0.16140000661835074,0.17090000619646162
is twitter s connections api broken some tweets didn t make it to twitter,Negative,is twitter s connections api broken some tweets didn t make it to twitter,0.0,0.22,0.78,0.009199997293762863,Neutral,0.08600000001024455,0.09519999730400741
i srsly hate the stupid twitter api timeout thing soooo annoying,Negative,i srsly hate the stupid twitter api timeout thing soooo annoying,0.0,0.583,0.417,0.00910000380827114,Negative,0.08030000026337802,0.08940000407164916
i really liked learning jquery book is worth a look too,Positive,i really liked learning jquery book is worth a look too,0.416,0.0,0.584,0.009199997293762863,Positive,0.0855999969644472,0.09479999425821006
very interesting ad from adobe by goodby silverstein amp partners youtube adobe cs le sens propre,Positive,very interesting ad from adobe by goodby silverstein amp partners youtube adobe cs le sens propre,0.166,0.0,0.834,0.009000003046821803,Neutral,0.08440000237897038,0.09340000542579219
goodby silverstein agency new site great,Positive,goodby silverstein agency new site great,0.451,0.0,0.549,0.009199997293762863,Positive,0.11010000162059441,0.11929999891435727
rt goodby silverstein s new site i enjoy it nice find,Positive,rt goodby silverstein s new site i enjoy it nice find,0.462,0.0,0.538,0.009200004569720477,Positive,0.08450000314041972,0.0937000077101402
the ever amazing psyop and goodby silverstein amp partners for hp have to go play with after effects now,Positive,the ever amazing psyop and goodby silverstein amp partners for hp have to go play with after effects now,0.267,0.0,0.733,0.009099996532313526,Neutral,0.09699999645818025,0.10609999299049377
top ten most watched on viral video chart love the nike mostvaluablepuppets campaign from wieden amp kennedy,Positive,top ten most watched on viral video chart love the nike mostvaluablepuppets campaign from wieden amp kennedy,0.286,0.0,0.714,0.009000003046821803,Neutral,0.07829999958630651,0.08730000263312832
zomg i have a g,Positive,zomg i have a g,0.0,0.0,1.0,0.008499999239575118,Neutral,0.09780000254977494,0.10630000178935006
ok so lots of buzz from io but how lucky are they a free g,Positive,ok so lots of buzz from io but how lucky are they a free g,0.494,0.0,0.506,0.009199997293762863,Positive,0.09660000068834051,0.10579999798210338
just got a free g android at google i o,Positive,just got a free g android at google i o,0.398,0.0,0.602,0.009099996532313526,Positive,0.09119999594986439,0.10029999248217791
guess i ll be retiring my g and start using my developer g woot googleio,Positive,guess i ll be retiring my g and start using my developer g woot googleio,0.203,0.0,0.797,0.009000003046821803,Neutral,0.07529999857069924,0.08430000161752105
i am happy for philip being at googleio today,Positive,i am happy for philip being at googleio today,0.346,0.0,0.654,0.00910000380827114,Positive,0.08499999967170879,0.09410000347997993
lakers played great cannot wait for thursday night lakers vs,Positive,lakers played great cannot wait for thursday night lakers vs,0.448,0.0,0.552,0.009099996532313526,Positive,0.09040000441018492,0.09950000094249845
judd apatow creates fake sitcom on nbc com to market his new movie viral marketing at its best,Positive,judd apatow creates fake sitcom on nbc com to market his new movie viral marketing at its best,0.258,0.127,0.615,0.00960000033956021,Neutral,0.0714999987394549,0.0810999990790151
viral marketing fail this acia pills brand oughta get shut down for hacking into people s messenger s i get msgs in a day arrrgh,Negative,viral marketing fail this acia pills brand oughta get shut down for hacking into people s messenger s i get msgs in a day arrrgh,0.0,0.149,0.851,0.009000003046821803,Neutral,0.07989999721758068,0.08890000026440248
watching night at the museum lmao,Positive,watching night at the museum lmao,0.438,0.0,0.562,0.009099996532313526,Positive,0.06359999679261819,0.07269999332493171
i loved night at the museum,Positive,i loved night at the museum,0.494,0.0,0.506,0.0092999980552122,Positive,0.06290000601438805,0.07220000406960025
just got back from the movies went to see the new night at the museum with rachel it was good,Positive,just got back from the movies went to see the new night at the museum with rachel it was good,0.132,0.0,0.868,0.009000003046821803,Neutral,0.0822000001790002,0.091200003225822
i will take you on a date to see night at the museum whenever you want it looks soooooo good,Positive,i will take you on a date to see night at the museum whenever you want it looks soooooo good,0.208,0.0,0.792,0.008999995770864189,Neutral,0.08230000094044954,0.09129999671131372
no watching the night at the museum getting really good,Positive,no watching the night at the museum getting really good,0.238,0.164,0.597,0.009500006854068488,Neutral,0.06900000153109431,0.0785000083851628
night at the museum wolverine and junk food perfect monday,Positive,night at the museum wolverine and junk food perfect monday,0.291,0.0,0.709,0.009000003046821803,Neutral,0.08570000500185415,0.09470000804867595
saw night at the museum last night pretty crazy movie but the cast was awesome so it was well worth it robin williams forever,Positive,saw night at the museum last night pretty crazy movie but the cast was awesome so it was well worth it robin williams forever,0.388,0.05,0.561,0.00960000033956021,Positive,0.08119999984046444,0.09080000018002465
