sentence,sentiment,cleaned_sentence,positive_score,negative_score,neutral_score,tiempo_fuzzification,sentimiento_defuzzificado,tiempo_defuzzificacion,tiempo_total
i still love my kindle but reading the new york times on it does not feel natural i miss the bloomingdale ads,Negative,i still love my kindle but reading the new york times on it does not feel natural i miss the bloomingdale ads,0.178,0.111,0.71,0.009399998816661537,Neutral,0.0870000003487803,0.09639999916544184
i love my kindle no more stacks of books to trip over on the way to the loo,Positive,i love my kindle no more stacks of books to trip over on the way to the loo,0.196,0.103,0.701,0.009199997293762863,Neutral,0.11180000001331791,0.12099999730708078
although today s keynote rocked for every great announcement at amp t shit on us just a little bit more,Negative,although today s keynote rocked for every great announcement at amp t shit on us just a little bit more,0.181,0.159,0.661,0.0092999980552122,Neutral,0.08750000415602699,0.09680000221123919
its not so much my obsession with cell phones but the iphone i m a slave to at amp t forever because of it,Negative,its not so much my obsession with cell phones but the iphone i m a slave to at amp t forever because of it,0.0,0.088,0.912,0.008700000762473792,Neutral,0.10860000475076959,0.11730000551324338
fuzzball is more fun than at amp t p,Negative,fuzzball is more fun than at amp t p,0.375,0.0,0.625,0.008600000001024455,Positive,0.09030000364873558,0.09890000364976004
today is a good day to dislike at amp t vote out of office indeed,Negative,today is a good day to dislike at amp t vote out of office indeed,0.176,0.158,0.667,0.009399998816661537,Neutral,0.08290000550914556,0.0923000043258071
got my wave sandbox invite extra excited too bad i have class now but i ll play with it soon enough io wave,Positive,got my wave sandbox invite extra excited too bad i have class now but i ll play with it soon enough io wave,0.241,0.089,0.671,0.009300005331169814,Neutral,0.0929000016185455,0.10220000694971532
looks like summize has gone down too many tweets from wwdc perhaps,Negative,looks like summize has gone down too many tweets from wwdc perhaps,0.185,0.0,0.815,0.008600000001024455,Neutral,0.10649999603629112,0.11509999603731558
thanks so much from one of your very happy kindle winners i was so surprised fabulous thank you best kathleen,Positive,thanks so much from one of your very happy kindle winners i was so surprised fabulous thank you best kathleen,0.658,0.0,0.342,0.008799994247965515,Positive,0.07700000423938036,0.08579999848734587
man i kinda dislike apple right now case in point the iphone gs wish there was a video recorder app please,Negative,man i kinda dislike apple right now case in point the iphone gs wish there was a video recorder app please,0.215,0.099,0.686,0.00960000033956021,Neutral,0.08550000347895548,0.09510000381851569
i have a kindle amp sony prs like it physical device feels good font is nice pg turns are snappy enuf ui a little klunky,Positive,i have a kindle amp sony prs like it physical device feels good font is nice pg turns are snappy enuf ui a little klunky,0.301,0.0,0.699,0.008600000001024455,Neutral,0.09190000128000975,0.1005000012810342
the kindle seems the best ereader but will it work in the uk and where can i get one,Positive,the kindle seems the best ereader but will it work in the uk and where can i get one,0.133,0.0,0.867,0.012800002878066152,Neutral,0.09819999831961468,0.11100000119768083
i have a google addiction thank you for pointing that out hahaha,Positive,i have a google addiction thank you for pointing that out hahaha,0.433,0.0,0.567,0.009499999578110874,Positive,0.07950000144774094,0.08900000102585182
dearest you rich bastards the visa card you sent me doesn t work why screw a little guy like me,Negative,dearest you rich bastards the visa card you sent me doesn t work why screw a little guy like me,0.339,0.194,0.467,0.009499999578110874,Neutral,0.0847000046633184,0.09420000424142927
excited about seeing bobby flay and guy fieri tomorrow at the great american food amp music fest,Positive,excited about seeing bobby flay and guy fieri tomorrow at the great american food amp music fest,0.302,0.0,0.698,0.009199997293762863,Neutral,0.09210000280290842,0.10130000009667128
gonna go see bobby flay moro at shoreline eat and drink gonna be good,Positive,gonna go see bobby flay moro at shoreline eat and drink gonna be good,0.182,0.0,0.818,0.008800001523923129,Neutral,0.08939999679569155,0.09819999831961468
can t wait for the great american food and music festival at shoreline tomorrow mmm katz pastrami and bobby flay yes please,Positive,can t wait for the great american food and music festival at shoreline tomorrow mmm katz pastrami and bobby flay yes please,0.42,0.0,0.58,0.008899995009414852,Positive,0.07449999975506216,0.08339999476447701
my dad was in ny for a day we ate at mesa grill last night and met bobby flay so much fun except i completely lost my voice today,Positive,my dad was in ny for a day we ate at mesa grill last night and met bobby flay so much fun except i completely lost my voice today,0.115,0.083,0.802,0.009499999578110874,Neutral,0.09970000246539712,0.109200002043508
fighting with latex again,Negative,fighting with latex again,0.0,0.455,0.545,0.009200004569720477,Negative,0.08269999671028927,0.09190000128000975
we love you too and don t want you to die latex the devil,Negative,we love you too and don t want you to die latex the devil,0.241,0.364,0.395,0.0092999980552122,Neutral,0.0855999969644472,0.0948999950196594
hours hours of inkscape crashing normally solid as a rock hours of latex complaining at the slightest thing i can t take any more,Negative,hours hours of inkscape crashing normally solid as a rock hours of latex complaining at the slightest thing i can t take any more,0.071,0.08,0.848,0.0092999980552122,Neutral,0.09660000068834051,0.10589999874355271
shit s hitting the fan in iran craziness indeed iranelection,Negative,shit s hitting the fan in iran craziness indeed iranelection,0.159,0.428,0.414,0.009399998816661537,Neutral,0.0853000019560568,0.09470000077271834
monday already iran may implode kitchen is a disaster seems happy had a nice weekend and is great whoop,Negative,monday already iran may implode kitchen is a disaster seems happy had a nice weekend and is great whoop,0.383,0.148,0.469,0.009300005331169814,Neutral,0.08479999814881012,0.09410000347997993
getting ready to test out some burger receipes this weekend bobby flay has some great receipes to try thanks bobby,Positive,getting ready to test out some burger receipes this weekend bobby flay has some great receipes to try thanks bobby,0.358,0.0,0.642,0.008600000001024455,Positive,0.12440000136848539,0.13300000136950985
i lam so in love with bobby flay he is my favorite rt you need a place in phoenix we have great peppers here,Positive,i lam so in love with bobby flay he is my favorite rt you need a place in phoenix we have great peppers here,0.379,0.0,0.621,0.008900002285372466,Positive,0.09080000018002465,0.09970000246539712
i just created my first latex file from scratch that didn t work out very well see it s a great time waster,Negative,i just created my first latex file from scratch that didn t work out very well see it s a great time waster,0.347,0.0,0.653,0.009000003046821803,Positive,0.0883999964571558,0.0973999995039776
using linux and loving it so much nicer than windows looking forward to using the wysiwyg latex editor,Positive,using linux and loving it so much nicer than windows looking forward to using the wysiwyg latex editor,0.307,0.0,0.693,0.008999995770864189,Neutral,0.08649999654153362,0.09549999231239781
after using latex a lot any other typeset mathematics just looks hideous,Positive,after using latex a lot any other typeset mathematics just looks hideous,0.0,0.0,1.0,0.008499999239575118,Neutral,0.10829999519046396,0.11679999443003908
on that note i hate word i hate pages i hate latex there i said it i hate latex all you texn rds can come kill me now,Negative,on that note i hate word i hate pages i hate latex there i said it i hate latex all you texn rds can come kill me now,0.0,0.52,0.48,0.00910000380827114,Negative,0.0689999942551367,0.07809999806340784
ahhh back in a real text editing environment i lt latex,Positive,ahhh back in a real text editing environment i lt latex,0.0,0.0,1.0,0.00839999847812578,Neutral,0.11249999806750566,0.12089999654563144
trouble in iran i see hmm iran iran so far away flockofseagullsweregeopoliticallycorrect,Negative,trouble in iran i see hmm iran iran so far away flockofseagullsweregeopoliticallycorrect,0.0,0.213,0.787,0.009000003046821803,Neutral,0.08549999620299786,0.09449999924981967
reading the tweets coming out of iran the whole thing is terrifying and incredibly sad,Negative,reading the tweets coming out of iran the whole thing is terrifying and incredibly sad,0.0,0.353,0.647,0.009000003046821803,Negative,0.09030000364873558,0.09930000669555739
